{
    "$schema": "https://raw.githubusercontent.com/input-output-hk/hermes/main/hermes/schemas/hermes_app_metadata.schema.json",
    "name": "HTTP Redirect Service",
    "version": "V0.1.0",
    "description": "Secure HTTP/HTTPS redirect service with configurable validation and routing policies",
    "src": [
        "https://github.com/input-output-hk/hermes",
        "https://github.com/input-output-hk/catalyst-voices"
    ],
    "copyright": [
        "Copyright â’¸ 2024, IOG Singapore."
    ],
    "license": [
        {
            "spdx": "Apache-2.0",
            "file": "/srv/data/apache2.txt",
            "note": "Apache 2.0 license for HTTP redirect service core functionality"
        },
        {
            "spdx": "MIT",
            "file": "/srv/data/mit.txt",
            "note": "MIT license for redirect validation utilities"
        }
    ],
    "developer": {
        "name": "IOG Singapore",
        "contact": "redirect-service@iohk.io",
        "payment": "wallet address"
    }
}